{
  "formatVersion": 3,
  "title": "常暗之厢",
  "coverImage": "assets/Image/Ui/cover-placeholder.svg",
  "startEvent": "E_001",
  "initialScene": "carriage_06",
  "initialState": {
    "sceneId": "carriage_06",
    "currentEventId": null,
    "flags": {},
    "inventory": [],
    "objectStates": {},
    "checkResults": {}
  }
}
